{
  "version": 1,
  "kind": "plan",
  "sourceSpec": "docs/specs/2610031513-run-prune.md",
  "run": {
    "shortName": "run-prune",
    "title": "Prune archived runs",
    "requiredCommands": [
      "pnpm gen:usage-spec",
      "pnpm docs:cli"
    ]
  },
  "preamble": {
    "summary": "Add `phax prune`, which deletes archived runs of the current namespace for real: the archive folder, the worktree metadata in the current repository, the run's local branches (`<branch>` and `<branch>--phase-NN`), and finally the registry entry. Pruning frees the run's name and its disk space. It never touches `phax/records/v1`, remote branches, remote-tracking refs or pull requests, and it never contacts a remote. Per spec Q1, a run whose local branches hold unpreserved commits is kept whole unless `--force` is given, and a branch checked out in a worktree keeps the run even with `--force`. Per Q2, selection is by names or `--all`. Per Q3, only the current namespace can be pruned. Per Q4, the command always prints a preview, asks on a TTY, accepts `--yes`, refuses without a TTY and supports `--dry-run`. Per Q5, a partial outcome exits 4.\n\nThe work has four phases, each green on its own. Phase 1 adds the read-only git and filesystem queries prune needs, behind the existing ports. Phase 2 adds the pure prune domain and the `prune` use case. Phase 3 adds the CLI command, the generated CLI surface and the end-to-end acceptance suite against a temporary repository and state root. Phase 4 updates the README prose and the phax-cli skill's lifecycle. Phase 4 edits `.claude/skills/phax-cli/SKILL.md`, so run the plan with `phax run --allow-skill-edits`.\n\nNo persisted format changes. The registry only loses the pruned entries and is written exactly as `upsertRun` writes it today. All fixtures are made up; nothing from ~/.phax or another repository enters this repository.",
    "requiredCommandsNote": "Both commands are already allowed by `security.agentCommands` in phax.json, so phax.json needs no change. Phase 3 runs them to regenerate phax.usage.kdl, docs/cli/reference.md and the README's generated CLI block. Every phase is verified by the existing `standard` gate profile.",
    "technicalArbitrations": [
      "Archive size is the apparent size: the sum of the lstat sizes of the regular files under the archive folder, without following symlinks, and 0 when the folder is absent. The same number is used in the preview, the report and the JSON. Accepted loss: it can differ from `du` (APFS clones, sparse files, block rounding), so the bytes reported as freed may not match what the disk reclaims exactly.",
      "The discard flag keeps the name `--force`, matching `phax archive --force` and the spec's usage.kdl sample. Accepted loss: it is less self-describing than `--discard-unpreserved`. The help text says it discards commits.",
      "Unpreserved commits are counted per branch with `git rev-list --count refs/heads/<b> --not --exclude=<each branch this command would delete> --branches --tags --remotes`. The excluded set is the union of all selected runs' branches (spec §4). Accepted loss: commits reachable only from a detached HEAD, the stash, a reflog or a non-branch ref count as unpreserved, and a selected run that ends up kept still does not preserve another selected run's commits. Both cases keep more and never lose work.",
      "Deletion order per run: archive folder, then worktree metadata, then local branches with `git branch -D` (safe because reachability was already checked; `-d` would refuse branches preserved only by a remote-tracking ref or a tag), then the registry entry last. Accepted loss: if branch deletion fails, the folder is already gone. The run is kept with `removal-failed`, and a re-run finishes it through the already-absent path (§5.18).",
      "Worktree metadata is cleared with `git worktree prune` (repository-wide, as archive does), then any remaining entry owned by the run (a path under `<stateRoot>/worktrees/<ns>.<name>` or under the archive folder) is removed with `git worktree remove --force`. Accepted loss: like archive, this also drops other runs' stale admin records.",
      "The expected branches of a run are its entry's `branch` plus `<branch>--phase-01..NN` up to the entry's `phasesCount`, together with any other present `<branch>--phase-NN`. This lets an absent branch be reported by name as already absent. Accepted loss: an absent phase branch numbered beyond `phasesCount` is not reported. Present branches are always found by listing refs.",
      "One use case, `prune`, takes a confirmation mode and a preview callback. The CLI derives the mode from the flags and the TTY through a pure domain helper and only renders. Accepted loss: the use case carries a rendering callback, so the CLI can print the preview before the question without making two use-case calls.",
      "When no selected run is planned for pruning (all kept, or `--all` found nothing), no confirmation is asked in any mode, because nothing would be deleted. Kept runs are reported with exit 4 even without a TTY. Accepted loss: a literal reading of §5.15 (exit 1 naming `--yes`) for an invocation that deletes nothing anyway.",
      "The prune command maps its own exit codes (0, 1, 3, 4, as pinned by the spec and the README table) rather than calling `exitCodeForError`, which maps LockConflictError to 7. Accepted loss: prune's lock-conflict code differs from the 7 that other commands return today. Reconciling that drift is out of scope."
    ]
  },
  "phases": [
    {
      "id": "phase-01",
      "model": "claude-opus-5-5",
      "effort": "medium",
      "planMarkdownAnchor": "#phase-01-prune-git-fs-queries",
      "plannedFilesToCreate": [
        "tests/integration/gitPruneQueries.test.ts",
        "tests/integration/fsApparentSize.test.ts"
      ],
      "plannedFilesToEdit": [
        "src/ports/git.ts",
        "src/ports/fs.ts",
        "src/schemas/git.ts",
        "src/infra/git.ts",
        "src/infra/fs.ts",
        "src/infra/fakes/git.ts",
        "src/infra/fakes/fs.ts",
        "tests/unit/schemas/git.test.ts"
      ],
      "optionalFilesToEdit": [
        "tests/unit/fakeRootedFileSystem.test.ts"
      ],
      "commit": {
        "subject": "feat(git): add ref, reachability and worktree queries for prune",
        "body": "Add the read-only queries phax prune needs behind the existing ports. The Git port gets listRefs (full ref names under a prefix), countUnpreservedCommits (commits a branch reaches that no other local branch, tag or remote-tracking ref keeps, ignoring a set of branches about to be deleted) and listWorktrees (the parsed git worktree list --porcelain). The FileSystem port gets apparentSize (the bytes of the regular files under a path, 0 when it is absent).\n\nGit output is decoded in src/schemas/git.ts. The fakes model the new queries, and the fake remove is now recursive like the real one. Real-git and real-filesystem integration tests pin the semantics. No command uses the queries yet."
      },
      "title": "Git and filesystem queries for prune",
      "objective": "Give the app layer the read-only facts prune decides on: which local branches and remote-tracking refs exist, how many commits a branch holds that nothing else keeps, which branch each worktree has checked out, and how big a folder is. Each fact comes through the existing Git and FileSystem ports, with node adapters, fakes and parsers at the schema boundary. Nothing calls them yet.",
      "detailedInstructions": [
        "In `src/ports/git.ts`, export `interface GitWorktreeEntry { readonly path: string; readonly branch: string | null; readonly prunable: boolean }`. `branch` is the short name without `refs/heads/`, or null for a detached or bare entry.",
        "Add to `GitOps`, each with a short doc comment: (1) `listRefs(repo: string, prefix: string): Effect.Effect<readonly string[], GitError>`, the full ref names under `prefix` (e.g. `refs/heads/`, `refs/remotes/`), sorted. (2) `countUnpreservedCommits(repo: string, branch: BranchName, deleting: readonly BranchName[]): Effect.Effect<number, GitError>`, the number of commits reachable from `refs/heads/<branch>` that no local branch outside `deleting`, no tag and no remote-tracking ref reaches. (3) `listWorktrees(repo: string): Effect.Effect<readonly GitWorktreeEntry[], GitError>`.",
        "In `src/schemas/git.ts`, add pure parsers next to the existing ones: `parseRefList(stdout)` (one ref per non-empty line, trimmed), `parseRevListCount(stdout)` (a non-negative integer, or null on malformed output), and `parseWorktreeListPorcelain(stdout)`. The porcelain parser reads blank-line-separated blocks of `worktree <path>`, `HEAD <sha>`, `branch refs/heads/<name>` | `detached` | `bare`, `locked [reason]` and `prunable [reason]`, and returns GitWorktreeEntry[]. Strip the `refs/heads/` prefix from the branch.",
        "In `src/infra/git.ts` (NodeGitLayer): `listRefs` runs `git for-each-ref --format=%(refname) <prefix>` and sorts the result. `countUnpreservedCommits` runs `git rev-list --count refs/heads/<branch> --not` followed by one `--exclude=<b>` per entry of `deleting` (short branch names: for `--branches`, git matches exclude patterns without the `refs/heads/` prefix), then `--branches --tags --remotes`. Fail with a GitError when the count does not parse. `listWorktrees` runs `git worktree list --porcelain` through `parseWorktreeListPorcelain`. Use the existing `gitRun` helper. Branch names are BranchName-validated, so they carry no glob metacharacters.",
        "In `src/ports/fs.ts`, add `apparentSize(path: string): Effect.Effect<number, FsError>` to `FileSystemOps`, with a doc comment: the sum of the lstat sizes of the regular files at or under `path`, symlinks not followed, and 0 when `path` does not exist. In `src/infra/fs.ts`, implement it with lstat plus a recursive readdir walk from node:fs/promises, resolving the path like the other ops. Forward it in `rootedAt`.",